{
  "$schema": "https://json-schema.org/draft/2020-12/schema",
  "$id": "https://vibecode.local/content-schemas/quest.json",
  "type": "object",
  "additionalProperties": false,
  "required": ["id", "kind", "displayName", "acceptNpcId", "turnInNpcId", "rewards", "completeOnce"],
  "properties": {
    "id": { "$ref": "https://vibecode.local/content-schemas/common.json#/$defs/contentId" },
    "kind": { "const": "quest" },
    "displayName": { "type": "string", "minLength": 1 },
    "category": { "type": "string", "enum": ["main", "side"] },
    "acceptNpcId": { "$ref": "https://vibecode.local/content-schemas/common.json#/$defs/contentId" },
    "turnInNpcId": { "$ref": "https://vibecode.local/content-schemas/common.json#/$defs/contentId" },
    "startNpcId": { "$ref": "https://vibecode.local/content-schemas/common.json#/$defs/contentId" },
    "prerequisites": { "$ref": "#/$defs/prerequisites" },
    "repeatable": { "type": "boolean" },
    "objectives": {
      "type": "array",
      "minItems": 1,
      "items": { "$ref": "#/$defs/objective" }
    },
    "stages": {
      "type": "array",
      "minItems": 1,
      "items": { "$ref": "#/$defs/stage" }
    },
    "consume": {
      "type": "array",
      "items": { "$ref": "https://vibecode.local/content-schemas/common.json#/$defs/itemStack" }
    },
    "rewards": { "$ref": "#/$defs/rewards" },
    "completeOnce": { "type": "boolean" },
    "itemReacquisition": {
      "type": "array",
      "items": { "$ref": "#/$defs/itemReacquisition" }
    },
    "schemaVersion": { "$ref": "https://vibecode.local/content-schemas/common.json#/$defs/definitionSchemaVersion" },
    "developmentOnly": { "$ref": "https://vibecode.local/content-schemas/common.json#/$defs/developmentOnly" }
  },
  "$defs": {
    "prerequisites": {
      "type": "object",
      "additionalProperties": false,
      "properties": {
        "questIds": {
          "type": "array",
          "items": { "$ref": "https://vibecode.local/content-schemas/common.json#/$defs/contentId" }
        },
        "minLevel": { "$ref": "https://vibecode.local/content-schemas/common.json#/$defs/nonNegativeInteger" },
        "classIds": {
          "type": "array",
          "items": { "$ref": "https://vibecode.local/content-schemas/common.json#/$defs/contentId" }
        }
      }
    },
    "stage": {
      "type": "object",
      "additionalProperties": false,
      "required": ["id", "objectives"],
      "properties": {
        "id": { "type": "string", "minLength": 1 },
        "objectives": {
          "type": "array",
          "minItems": 1,
          "items": { "$ref": "#/$defs/objective" }
        }
      }
    },
    "objective": {
      "type": "object",
      "additionalProperties": false,
      "required": ["type"],
      "properties": {
        "type": {
          "type": "string",
          "enum": [
            "acquire_item",
            "talk_to_npc",
            "kill_enemy",
            "collect_item",
            "enter_location",
            "defeat_boss",
            "return_to_npc"
          ]
        },
        "itemId": { "$ref": "https://vibecode.local/content-schemas/common.json#/$defs/contentId" },
        "npcId": { "$ref": "https://vibecode.local/content-schemas/common.json#/$defs/contentId" },
        "enemyId": { "$ref": "https://vibecode.local/content-schemas/common.json#/$defs/contentId" },
        "quantity": { "$ref": "https://vibecode.local/content-schemas/common.json#/$defs/positiveInteger" },
        "enemyTags": {
          "type": "array",
          "items": { "type": "string", "minLength": 1 }
        },
        "itemTags": {
          "type": "array",
          "items": { "type": "string", "minLength": 1 }
        },
        "zoneId": { "$ref": "https://vibecode.local/content-schemas/common.json#/$defs/contentId" },
        "instanceId": { "type": "string", "minLength": 1 },
        "location": { "$ref": "https://vibecode.local/content-schemas/common.json#/$defs/aabb" },
        "partyCreditPolicy": { "type": "string", "enum": ["solo", "party"] },
        "countEquipment": { "type": "boolean" }
      }
    },
    "itemReacquisition": {
      "type": "object",
      "additionalProperties": false,
      "required": ["itemId", "policy", "sources"],
      "properties": {
        "itemId": { "$ref": "https://vibecode.local/content-schemas/common.json#/$defs/contentId" },
        "policy": {
          "type": "string",
          "enum": [
            "REPEATABLE_DROP",
            "REPEATABLE_INTERACTION",
            "MERCHANT_AVAILABLE",
            "MULTIPLE_WORLD_SOURCES",
            "EXPLICIT_EXTERNAL_ACQUISITION"
          ]
        },
        "sources": {
          "type": "array",
          "minItems": 1,
          "items": {
            "type": "object",
            "additionalProperties": false,
            "required": ["type", "id"],
            "properties": {
              "type": {
                "type": "string",
                "enum": ["loot_table", "enemy", "spawn", "vendor", "npc", "external"]
              },
              "id": { "$ref": "https://vibecode.local/content-schemas/common.json#/$defs/contentId" }
            }
          }
        }
      }
    },
    "rewards": {
      "type": "object",
      "additionalProperties": false,
      "required": ["gold", "items"],
      "properties": {
        "gold": { "$ref": "https://vibecode.local/content-schemas/common.json#/$defs/nonNegativeInteger" },
        "xp": { "$ref": "https://vibecode.local/content-schemas/common.json#/$defs/nonNegativeInteger" },
        "items": {
          "type": "array",
          "items": { "$ref": "https://vibecode.local/content-schemas/common.json#/$defs/itemStack" }
        },
        "abilityUnlockIds": {
          "type": "array",
          "items": { "$ref": "https://vibecode.local/content-schemas/common.json#/$defs/contentId" }
        },
        "attributePoints": { "$ref": "https://vibecode.local/content-schemas/common.json#/$defs/nonNegativeInteger" },
        "skillPoints": { "$ref": "https://vibecode.local/content-schemas/common.json#/$defs/nonNegativeInteger" }
      }
    }
  }
}
