{
  "id": "quest.proof_errand",
  "kind": "quest",
  "displayName": "Proof Errand",
  "category": "side",
  "acceptNpcId": "npc.proof_giver",
  "turnInNpcId": "npc.proof_giver",
  "objectives": [
    {
      "type": "acquire_item",
      "itemId": "item.proof_token",
      "quantity": 1
    }
  ],
  "consume": [
    {
      "itemId": "item.proof_token",
      "quantity": 1
    }
  ],
  "rewards": {
    "gold": 8,
    "xp": 5,
    "items": []
  },
  "completeOnce": true,
  "itemReacquisition": [
    {
      "itemId": "item.proof_token",
      "policy": "REPEATABLE_DROP",
      "sources": [
        { "type": "loot_table", "id": "loot.proof_critter" }
      ]
    }
  ]
}
