{
  "id": "quest.slime_problem",
  "kind": "quest",
  "displayName": "Slime Problem",
  "category": "main",
  "acceptNpcId": "npc.elder",
  "turnInNpcId": "npc.elder",
  "objectives": [
    {
      "type": "acquire_item",
      "itemId": "item.slime_gel",
      "quantity": 1
    }
  ],
  "consume": [
    {
      "itemId": "item.slime_gel",
      "quantity": 1
    }
  ],
  "rewards": {
    "gold": 25,
    "xp": 20,
    "items": [
      {
        "itemId": "item.iron_sword",
        "quantity": 1
      }
    ]
  },
  "completeOnce": true,
  "itemReacquisition": [
    {
      "itemId": "item.slime_gel",
      "policy": "REPEATABLE_DROP",
      "sources": [
        { "type": "loot_table", "id": "loot.green_slime" }
      ]
    }
  ]
}
