{
  "id": "quest.test.party_kill",
  "kind": "quest",
  "displayName": "Test Party Kill",
  "category": "side",
  "acceptNpcId": "npc.test_herald",
  "turnInNpcId": "npc.test_herald",
  "objectives": [
    {
      "type": "kill_enemy",
      "enemyId": "enemy.green_slime",
      "enemyTags": ["slime"],
      "quantity": 1,
      "zoneId": "zone.starter",
      "partyCreditPolicy": "party"
    }
  ],
  "consume": [],
  "rewards": {
    "gold": 1,
    "xp": 1,
    "items": []
  },
  "completeOnce": true
}
